{
  "decision_id": "DECISION-RECONCILE-001",
  "as_of": "2026-07-28",
  "question": "How should the adapter resolve an ambiguous outcome after a vendor write?",
  "selected_option": "Read by stable external identity, compare the canonical payload digest, and select completion or bounded retry from the observed state.",
  "alternatives": [
    "Route every ambiguous outcome directly to manual review.",
    "Use a bounded retry followed by authoritative readback."
  ],
  "assumption_ids": [
    "ASSUMPTION-VENDOR-READBACK-001"
  ],
  "predicted_effects": [
    {
      "measure": "duplicate vendor effects",
      "prediction": "zero across twenty exact replays",
      "window": "configured-vendor qualification run"
    },
    {
      "measure": "ambiguous outcome recovery",
      "prediction": "five of five injected outcomes reconciled",
      "window": "configured-vendor qualification run"
    }
  ],
  "probability": 0.78,
  "falsifiers": [
    "The configured vendor environment cannot query by the stable external identity.",
    "Authoritative readback latency exceeds the approved recovery objective."
  ],
  "decision_authority": "advisory",
  "status": "selected",
  "metadata": {
    "schema_version": "1.0.0",
    "created_at": "2026-07-28T14:15:00Z",
    "updated_at": "2026-07-28T14:15:00Z",
    "owner": {
      "actor_id": "OWNER-ARCH-001",
      "display_name": "Simulation Architect",
      "role": "Simulation decision steward",
      "organization": "Example Laboratory"
    }
  }
}
